{
  "schemaVersion": "research-evidence.v1",
  "evidenceSetId": "evidence-taptap-828363891523190942",
  "title": "V4.4 姬子·启行列车护盾挂机流证据",
  "gameMode": "currency-wars",
  "applicableGameVersions": [
    "4.4"
  ],
  "createdAt": "2026-07-27T13:40:00Z",
  "updatedAt": "2026-08-01T14:00:00Z",
  "createdBy": {
    "kind": "mixed",
    "name": "local audited research migration"
  },
  "source": {
    "sourceId": "taptap-828363891523190942",
    "title": "【V4.4攻略】货币战争A850攻略｜姬子·启行挂机流",
    "platform": "TapTap",
    "author": "冻梨游研社",
    "url": "https://www.taptap.cn/moment/828363891523190942",
    "publishedAt": "2026-07-20T04:22:21Z",
    "accessedAt": "2026-07-27",
    "contentType": "article",
    "language": "zh-CN",
    "applicableGameVersions": [
      "4.4"
    ],
    "reuseStatus": "linked_only",
    "reuseNotes": "只保留链接、定位和转述，不捆绑正文。"
  },
  "claims": [
    {
      "claimId": "metadata-v44-a850",
      "topic": "source_metadata",
      "statement": "页面标题明确标注 V4.4 与 A850 攻略。",
      "assertionType": "source_fact",
      "supportStatus": "direct",
      "confidence": 0.99,
      "locator": {
        "kind": "page",
        "value": "article:h1 标题"
      },
      "applicableGameVersions": [
        "4.4"
      ],
      "subjectRefs": {
        "characterIds": [],
        "equipmentIds": [],
        "bondIds": [],
        "investmentEnvironmentIds": [],
        "investmentStrategyIds": [],
        "enemyAffixIds": [],
        "otherRefs": []
      },
      "conditions": [],
      "conflicts": [],
      "notes": []
    },
    {
      "claimId": "core-train-shield",
      "topic": "archetype_core",
      "statement": "作者将姬子·启行与三月七的列车同行、护盾和反击联动作为路线核心。",
      "assertionType": "author_recommendation",
      "supportStatus": "direct",
      "confidence": 0.93,
      "locator": {
        "kind": "section",
        "value": "article:h2 一、阵容优势"
      },
      "applicableGameVersions": [
        "4.4"
      ],
      "subjectRefs": {
        "characterIds": [
          "currency_wars_character_01",
          "currency_wars_character_67"
        ],
        "equipmentIds": [],
        "bondIds": [
          "currency_wars_bond_11",
          "currency_wars_bond_15"
        ],
        "investmentEnvironmentIds": [],
        "investmentStrategyIds": [],
        "enemyAffixIds": [],
        "otherRefs": []
      },
      "conditions": [
        "采用姬子·启行列车护盾路线"
      ],
      "conflicts": [],
      "notes": [
        "这是作者攻略建议，不是官方强度保证。"
      ]
    },
    {
      "claimId": "early-low-cost-transition",
      "topic": "early_game",
      "statement": "作者建议第一位面使用低费混合羁绊过渡，并以首个首领前达到 6 级为阶段目标。",
      "assertionType": "author_recommendation",
      "supportStatus": "direct",
      "confidence": 0.9,
      "locator": {
        "kind": "section",
        "value": "article:h2 二、初期过渡"
      },
      "applicableGameVersions": [
        "4.4"
      ],
      "subjectRefs": {
        "characterIds": [],
        "equipmentIds": [],
        "bondIds": [
          "currency_wars_bond_14",
          "currency_wars_bond_17",
          "currency_wars_bond_12"
        ],
        "investmentEnvironmentIds": [],
        "investmentStrategyIds": [],
        "enemyAffixIds": [],
        "otherRefs": []
      },
      "conditions": [
        "第一位面",
        "核心角色尚未成型"
      ],
      "conflicts": [],
      "notes": []
    },
    {
      "claimId": "pivot-if-no-himeko",
      "topic": "transition_branch",
      "statement": "作者把第二位面仍未获得姬子·启行时转向希儿量子路线列为备选。",
      "assertionType": "author_recommendation",
      "supportStatus": "direct",
      "confidence": 0.88,
      "locator": {
        "kind": "section",
        "value": "article:h2 三、中期运营；article:h2 四、终局"
      },
      "applicableGameVersions": [
        "4.4"
      ],
      "subjectRefs": {
        "characterIds": [
          "currency_wars_character_01",
          "currency_wars_character_35"
        ],
        "equipmentIds": [],
        "bondIds": [
          "currency_wars_bond_22"
        ],
        "investmentEnvironmentIds": [],
        "investmentStrategyIds": [],
        "enemyAffixIds": [],
        "otherRefs": []
      },
      "conditions": [
        "进入第二位面",
        "未获得姬子·启行"
      ],
      "conflicts": [],
      "notes": [
        "具体转型成本仍取决于当局经济与已持有角色。"
      ]
    }
  ],
  "extractionStatus": "complete",
  "unknowns": [],
  "deduplicationKey": "taptap:828363891523190942",
  "notes": [
    "由项目内已审核研究结果迁移；未复制原文。"
  ]
}
